"Four-Year Graduation Rates, 2011-12"
"State of Connecticut, Free/Reduced Price Meal Eligibility"

"",,,"Graduates",,"Non-Graduates",,,
"District","Free/Reduced Price Meal Eligibility","Four-Year Cohort Count","Graduation Count","Graduation Rate","Still Enrolled Count","Still Enrolled Rate","Other Count","Other Rate"
"State of Connecticut","Eligible For Free Lunch",12371,8239,66.6,1324,10.7,2804,22.7
"State of Connecticut","Eligible For Reduced Lunch",3718,3106,83.5,236,6.3,376,10.1
"State of Connecticut","Not Eligible For Lunch",27794,25883,93.1,804,2.9,1106,4.0

